PeakStream,https://www.crunchbase.com/organization/peakstream,"Apps, Hardware, Software","Redwood City, California, United States",PeakStream provides a software application platform for the high-performance computing market.,"142,972",2005,Active,,,,,,,,,,1-10,2,M&A,"Sep 18, 2006","$17,000,000",Series B,"$17,000,000",Series B,"$22,000,000","$22,000,000",1,3,Was Acquired,Private,,,,
Quorum Systems,https://www.crunchbase.com/organization/quorum-systems,"Hardware, Manufacturing, Science and Engineering, Software","Carlsbad, California, United States",Quorum Systems is a fabless semiconductor company developing and delivering integrated single-chip CMOS radio frequency transceivers.,"145,147",2002,Active,,For Profit,,,,,,,,1-10,3,M&A,"Oct 25, 2006","$15,000,000",Series C,"$15,000,000",Series C,"$39,350,000","$39,350,000",3,4,Was Acquired,Private,,,,
LiveCapital,https://www.crunchbase.com/organization/livecapital,"Commerce and Shopping, Financial Services","San Mateo, California, United States",LiveCapital provides online small business financing.,"146,299",1996,Active,,For Profit,,,,,,,,,2,M&A,"Mar 17, 2003","$7,400,000",Series A,"$7,400,000",Series A,"$47,400,000","$47,400,000",1,10,Was Acquired,Private,,,,
Zaffire,https://www.crunchbase.com/organization/zaffire,"Commerce and Shopping, Transportation","San Jose, California, United States","Zaffire, Inc. is an innovative new optical networking company.","152,044",1998,Active,,For Profit,,,,,,,,,2,M&A,"Jun 7, 2000","$85,000,000",Series C,"$85,000,000",Series C,"$85,000,000","$85,000,000",1,16,Was Acquired,Private,,,,
SEEC,https://www.crunchbase.com/organization/seec,"Financial Services, Information Technology, Software","Pittsburgh, Pennsylvania, United States","Provides software solutions to insurance, healthcare, and financial services enterprises","152,416",1988,Active,,,,,,,,,,51-100,1,M&A,"Jan 10, 2003","$1,300,000",Venture - Series Unknown,"$1,300,000",Venture - Series Unknown,"$1,300,000","$1,300,000",,1,"Made Acquisitions, Was Acquired",Delisted,"Jan 22, 1997","Sep 30, 2008","$28,000,000","$13,050,000"
Virsa Systems,https://www.crunchbase.com/organization/virsa-systems,"Privacy and Security, Professional Services, Software","Boulevard, California, United States",Virsa Systems is a software company related to security and controls.,"166,855",1996,Active,,For Profit,,,,,,,1,101-250,1,M&A,"Jul 20, 2004","$15,000,000",Series A,"$15,000,000",Series A,"$15,000,000","$15,000,000",2,2,Was Acquired,Private,,,,
Oblix,https://www.crunchbase.com/organization/oblix,"Commerce and Shopping, Software","Cupertino, California, United States",Oblix develops identity-based security and provides web access management solutions for e-commerce networks.,"167,369",1996,Active,,,,,,,,,3,,7,M&A,"Sep 15, 2004",,Venture - Series Unknown,,Venture - Series Unknown,"$125,300,000","$125,300,000",2,20,"Made Acquisitions, Was Acquired",Private,,,,
Oakley Networks,https://www.crunchbase.com/organization/oakley-networks,"Information Technology, Privacy and Security, Software","Salt Lake City, Utah, United States",Oakley Networks develops specialized network security software for managing insider threat risks,"170,120",Mar 2002,Active,,For Profit,,,,,,,,51-100,3,M&A,"Oct 21, 2006","$12,000,000",Series B,"$12,000,000",Series B,"$44,790,000","$44,790,000",2,3,Was Acquired,Private,,,,
Good Technology (acquired by Visto),https://www.crunchbase.com/organization/good-technology-acquired-by-visto,"Apps, Software","Santa Clara, California, United States","Good Technology is a software company, provides the mobile e-mail applications.","171,798",Mar 2000,Active,,For Profit,,,,,,,3,,7,M&A,"Feb 27, 2006","$20,000,000",Series E,"$20,000,000",Series E,"$248,000,000","$248,000,000",3,13,Was Acquired,Private,,,,
Vividence,https://www.crunchbase.com/organization/vividence,"Information Technology, Software","San Mateo, California, United States",Vividence Corporation provides market information services and evaluation applications to e-businesses.,"177,139",1998,Active,,For Profit,,,,,,,,,2,M&A,"Sep 5, 2000",,Series D,,Series D,"$12,500,000","$12,500,000",1,3,Was Acquired,Private,,,,
"iolon, inc.",https://www.crunchbase.com/organization/iolon-inc,"Community and Lifestyle, Hardware, Manufacturing","San Jose, California, United States",A privately held optical networking components company.,"178,651",2000,Active,,For Profit,,,,,,,1,,3,M&A,"Apr 25, 2002","$9,000,000",Debt Financing,"$7,600,000",Series C,"$60,600,000","$69,600,000",1,21,Was Acquired,Private,,,,
Mobilygen,https://www.crunchbase.com/organization/mobilygen,"Hardware, Manufacturing, Science and Engineering, Software","Santa Clara, California, United States",Mobilygen Corporation is a fabless semiconductor company focused on developing multimedia processors.,"179,012",1998,Active,,For Profit,,,,,,,1,,5,M&A,"Nov 7, 2007","$9,000,000",Series E,"$9,000,000",Series E,"$43,700,000","$43,700,000",,7,Was Acquired,Private,,,,
ipVerse,https://www.crunchbase.com/organization/ipverse,"Information Technology, Manufacturing, Software","Sunnyvale, California, United States","ipVerse offers ControlSwitch, a software switch that focuses on increasing the quality of communications.","181,198",1998,Active,,For Profit,,,,,,,,,2,M&A,"Sep 18, 2000","$21,800,000",Series C,"$21,800,000",Series C,"$38,300,000","$38,300,000",2,3,Was Acquired,Private,,,,
Corthera,https://www.crunchbase.com/organization/corthera,"Biotechnology, Health Care, Science and Engineering","San Carlos, California, United States","Corthera is engaged in acquiring, developing and commercializing therapies for illnesses in the acute care setting.","185,126",2002,Active,,For Profit,,,,,,,,1-10,3,M&A,"Dec 20, 2007","$23,000,000",Series C,"$23,000,000",Series C,"$40,140,000","$40,140,000",,4,Was Acquired,Private,,,,
Teloquent Communications,https://www.crunchbase.com/organization/teloquent-communications,"Administrative Services, Hardware","Billerica, Massachusetts, United States","Teloquent Communications, a provider of virtual call center solutions for Web and conventional telephone-based customer interaction.","192,038",Jun 1989,Active,,For Profit,,,,,,,,,1,M&A,"Jun 8, 2000","$12,600,000",Venture - Series Unknown,"$12,600,000",Venture - Series Unknown,"$12,600,000","$12,600,000",1,7,Was Acquired,Private,,,,
CENiX,https://www.crunchbase.com/organization/cenix,"Hardware, Manufacturing, Mobile","Allentown, Pennsylvania, United States","CENiX, Inc. is a manufacturer of next generation high-speed optoelectronic interfaces.","192,132",Jun 2000,Active,,For Profit,,,,,,,,,3,M&A,"Oct 23, 2001","$34,000,000",Series B,"$34,000,000",Series B,"$59,500,000","$77,500,000",,9,Was Acquired,Private,,,,
Vertical Networks,https://www.crunchbase.com/organization/vertical-networks,"Financial Services, Hardware, Software","Sunnyvale, California, United States",Vertical Networks is a provider of distributed IP-PBX software and communications solutions to large enterprises.,"193,784",1996,Active,,For Profit,,,,,,,,,3,M&A,"Jun 23, 2001","$15,000,000",Series F,"$15,000,000",Series F,"$94,000,000","$94,000,000",1,14,Was Acquired,Private,,,,
Linuxcare,https://www.crunchbase.com/organization/linuxcare,"Education, Hardware, Internet Services, Manufacturing, Software","San Francisco, California, United States","Linuxcare provides professional, technical support, education, and product certification services for Linux.","204,983",1998,Active,,,,,,,,,2,501-1000,1,M&A,"Aug 3, 2000","$30,000,000",Series C,"$30,000,000",Series C,"$30,000,000","$30,000,000",1,9,Was Acquired,Private,,,,
Siara Systems,https://www.crunchbase.com/organization/siara-systems,"Hardware, Internet Services","Sunnyvale, California, United States",Siara Systems is a provider of next-generation IP over SONET solutions aimed at carrying both traditional and IP-based services.,"216,553",1998,Active,,For Profit,,,,,,,,,1,M&A,"May 6, 1999","$25,000,000",Series B,"$25,000,000",Series B,"$25,000,000","$25,000,000",,3,Was Acquired,Private,,,,
Pictos Technologies,https://www.crunchbase.com/organization/pictos-technologies,"Information Technology, Sales and Marketing, Software","Newport Beach, California, United States",Pictos Technologies offers digital imaging solutions that combine integrated semiconductors.,"240,697",2002,Active,,For Profit,,,,,,,,1-10,1,M&A,"Jul 31, 2002","$17,000,000",Series B,"$17,000,000",Series B,"$17,000,000","$17,000,000",1,6,Was Acquired,Private,,,,
MetaMatrix,https://www.crunchbase.com/organization/metamatrix-red-hat,"Information Technology, Software","Duluth, Georgia, United States",MetaMatrix is an U.S.-based technology company that created the first true Enterprise Information Integration (EII) software product.,"253,315",1998,Active,,For Profit,,,,,,,1,51-100,3,M&A,"Sep 1, 2004","$12,000,000",Series F,"$12,000,000",Series F,"$22,230,000","$22,230,000",,6,Was Acquired,Private,,,,
Icarian,https://www.crunchbase.com/organization/icarian-2,"Administrative Services, Internet Services","Sunnyvale, California, United States",A provider of Workforce eServices,"291,760",1997,Active,,For Profit,,,,,,,,11-50,2,M&A,"Nov 13, 2001","$24,000,000",Venture - Series Unknown,"$24,000,000",Venture - Series Unknown,"$79,000,000","$79,000,000",1,7,Was Acquired,Private,,,,
Viewpoint Digital,https://www.crunchbase.com/organization/viewpoint-digital,"Consumer Electronics, Design, Hardware, Software","Huddersfield, Kirklees, United Kingdom","Viewpoint designs, builds and sells 3D models to the computer graphics industry.","297,196",1988,Active,,For Profit,,,,,,,1,,2,M&A,"Feb 12, 1994","$13,000,000",Venture - Series Unknown,"$13,000,000",Venture - Series Unknown,"$15,000,000","$15,000,000",,4,Was Acquired,Private,,,,
Omniva Policy Systems,https://www.crunchbase.com/organization/omniva-policy-systems,"Information Technology, Internet Services, Messaging and Telecommunications, Privacy and Security, Software","San Francisco, California, United States",Omniva Policy Systems provides transparent and easy-to-use secure messaging policy solutions.,"344,671",1999,Active,,For Profit,,,,,,,,1-10,1,M&A,"Jun 27, 2003","$4,000,000",Series B,"$4,000,000",Series B,"$4,000,000","$4,000,000",1,3,Was Acquired,Private,,,,
Intersperse,https://www.crunchbase.com/organization/intersperse-inc,"Apps, Information Technology, Software","Pasadena, California, United States",Intersperse is a leading provider of management solutions for service-oriented enterprise applications.,"367,347",Mar 2000,Active,,For Profit,,,,,,,,,2,M&A,"Jul 18, 2003","$9,300,000",Series C,"$9,300,000",Series C,"$21,300,000","$21,300,000",,4,Was Acquired,Private,,,,
NexVerse Networks,https://www.crunchbase.com/organization/nexverse-networks,"Internet Services, Platforms, Software","San Jose, California, United States",NexVerse Networks Inc. supplies generation softswitch solutions based on the ipVerse ControlSwitch platform.,"400,574",Oct 2001,Active,,For Profit,,,,,,,,,1,M&A,"Dec 11, 2001","$15,000,000",Venture - Series Unknown,"$15,000,000",Venture - Series Unknown,"$15,000,000","$15,000,000",1,4,"Made Acquisitions, Was Acquired",Private,,,,
ServiceMaster Home Service Center,https://www.crunchbase.com/organization/servicemaster-home-service-center,Real Estate,"Downers Grove, Illinois, United States","ServiceMaster Home Service Center is an online service, allowing homeowners to schedule and purchase repairs and maintenance services.","543,420",2000,Active,,For Profit,,,,,,,,,1,M&A,"Jan 31, 2001","$15,000,000",Venture - Series Unknown,"$15,000,000",Venture - Series Unknown,"$15,000,000","$15,000,000",,2,Was Acquired,Private,,,,
